id;title;edition;isbn;udc;bbk;publication_year;circulation;price;in_stock;weight;age_limit;format;cover_type;page_count;publisher_id;city_id;book_series_id;language_id;subtitle
1;Человек-невидимка;1;978-5-04-093908-4;821.111-9;84(4Вел)-80;2018;2000;450;5;210;12+;20.7 x 13 x 1.7;Твердая глянцевая;192;1;1;1;1;'Можно ли делать физические тела невидимыми? Звучит невероятно!
Гениальный ученый Гриффин находит способ. Желая ослепить весь мир этим открытием, он проводит эксперимент на себе. Невидимость должна была позволить Гриффину осуществить самые дерзкие и фантастические планы, но обернулась настоящим кошмаром. 
Сможет ли он вернуть человеческий облик? Или же превратится в безумца, опасного для общества? 
Графический роман "Человек-невидимка" с первых страниц погружает читателя в удивительный мир, в котором невозможное становится реальностью!
Классический сюжет оживает на страницах комикса, а потрясающие иллюстрации рассказывают историю, полную ярких деталей и красочных образов!'
2;Великие трагедии и комедии в одном томе;1;978-5-04-092582-7;821.111-2;84(4Вел)-6;2018;3000;619;10;1020;16+;21.9 x 14.4 x 5.2;Твердая бумажная;1120;1;1;2;1;'Уильям Шекспир, великий драматург и поэт, крупнейший гуманист эпохи позднего Возрождения, оставил потомкам богатейшее литературное наследие. Один из самых загадочных творцов слова поставил перед человечеством вопрос "Быть или не быть?", предоставив каждому возможность искать ответ самому. В сборник пьес английского Барда вошли избранные трагедии и комедии, которые оказали огромное влияние на всю европейскую литературу.'
3;Хождение по мукам;2;978-5-04-090341-2;821.161.1-31;84(2Рос=Рус)6-44;2018;3000;354;20;580;16+;20.6 x 13.2 x 3.5;Твердая бумажная;800;1;1;3;1;'Знаменитая трилогия Алексея Толстого "Хождение по мукам" — увлекательное повествование о судьбах двух сестер, Кати и Даши Булавиных, на фоне масштабных исторических событий: во времена Первой мировой войны, двух революций, Гражданской войны. По словам самого автора, "Хождение по мукам" — хождение совести самого автора по страданиям, надеждам, восторгам и падениям, унынию, взлетам — ощущение целой огромной эпохи.'
4;Отцы и дети;1;978-5-04-091540-8;821.161.1-3;84(2Рос=Рус)1-44;2018;2000;260;12;350;16+;20.6 x 13.2 x 2;Твердая бумажная;480;1;1;3;1;'Иван Сергеевич Тургенев (1818-1883) – удивительный, очень русский писатель, чей талант был признан и соотечественниками, и великими европейскими поэтами и прозаиками. "Острый и тонкий наблюдатель, точный до мелочей, он рисует своих героев как поэт и живописец. Ему одинаково интересны как их страсти, так и черты их лица… С большим искусством живописует он физическую и моральную сторону явлений, создавая реальные картины действительности…" – написал Проспер Мериме, автор "Кармен".
Эта книга представляет важнейшие грани творчества И. С. Тургенева. В нее включены роман "Отцы и дети", повести и стихотворения в прозе.'
5;Я вас любил…;1;978-5-699-42801-4;821.161.1-1;84(2Рос=Рус)1-5;2017;300;226;5;460;16+;20.6 x 13.6 x 4.1;Твердая бумажная;640;1;1;3;1;'А.С. Пушкин (1799 -1837) – величайший русский поэт, реформатор и создатель новой русской литературы, в своем творчестве придавший языку необыкновенную легкость, изысканность и одновременно точность выражения мысли; приблизивший народную речь к литературному языку, что и стало нормой. Стиль его произведений признают эталонным. Его перу было подвластно все: философская, гражданская, любовная лирика, переводы, подражания древним, сатирические жанры, в том числе эпиграммы. Свои жизненные и мировоззренческие искания Пушкин воплотил в стихотворениях, в которых отразилась широта интересов и трансформация взглядов поэта.'
6;Остров Сокровищ;1;978-5-699-99082-5;821.111-9;84(4Вел)-80;2018;5000;354;10;500;12+;28.5 x 21.5 x 0.7;Твердая глянцевая;64;1;1;1;1;'"Остров сокровищ" – увлекательная приключенческая история об охоте за сокровищами. Один из лучших романов о пиратах теперь в форме комикса!
Данная графическая адаптация была разработана в сотрудничестве с Международной Федерацией преподавателей французского языка и издана при поддержке Юнеско. Читателю предоставлена уникальная возможность отправиться в захватывающее литературное путешествие и погрузиться в удивительный мир оригинального произведения.
В конце издания даны биография автора, комментарии к его творчеству, разъяснения исторического и литературного контекста.'
7;Путешествие к центру Земли;1;978-5-04-093267-2;821.133.1-312.9;84(4Фра)-44;2018;3000;372;15;370;16+;20.6 x 13 x 2.2;Твердая бумажная;384;1;1;4;1;'Классический научно-фантастический роман о затерянном мире!
Отто Лиденброк, немецкий ученый, профессор геологии и минералогии, весной 1863 года находит в старинной исландской книге зашифрованный пергамент. В результате расшифровки выяснилось, что известный исландский ученый-алхимик XVI века якобы спускался в кратер потухшего вулкана и достиг центра Земли. Лиденброк решил воспользоваться указанными координатами и повторить подвиг древнего алхимика. Ни сам ученый, ни увязавшийся за ним племянник Аксель не подозревали, что их ждет впереди…
Роман был неоднократно экранизирован.'
8;Затерянный мир;1;978-5-04-093265-8;821.161.1-312.9;83(2Рос=Рус)6-44;2018;3000;372;15;330;16+;20.5 x 13 x 2;Твердая бумажная;320;1;1;4;1;'Классический научно-фантастический роман о затерянном мире!
Гениальный, но эксцентричный британский ученый, профессор Челленджер заявил, что во время путешествия по Южной Америке обнаружил территорию, где до сих пор сохранились вымершие животные. В сопровождении лорда Рокстона, коллеги Саммерли и репортера "Дейли-газетт" Мелоуна профессор Челленджер отправляется в экспедицию, где ему и его товарищам придется столкнуться с кошмарными тварями, порожденными эволюцией…
Роман был неоднократно экранизирован.'
9;Гарри Поттер и Тайная комната;3;978-5-38-911558-3;null;null;2016;10000;1298;105;1360;6+;27.5 x 23.5 x 3;Суперобложка;264;2;2;5;1;'Книга, покорившая мир, эталон литературы для читателей всех возрастов, синоним успеха.
Книга, сделавшая Джоан Роулинг самым читаемым писателем современности. Книга, ставшая культовой уже для нескольких поколений.'
10;Хроники Нарнии;1;978-5-69-992300-7;null;null;2017;12000;550;56;920;6+;22 x 14.4 x 4;Твердая глянцевая;912;1;2;6;1;'Вся история Нарнии в 7 повестях.
Древние мифы, старинные предания и волшебные сказки, детские впечатления и взрослые размышления прекрасного английского писателя Клайва С. Льюиса легли в основу семи повестей эпопеи «Хроники Нарнии», ставшей одной из самых известных и любимых книг детей и взрослых во всем мире.
Читая книгу, вы снова и снова будете открывать чарующий волшебный мир Нарнии - и попадете в страну, которую могут по-настоящему увидеть только дети и люди с чистой душой и открытым сердцем.'
11;Ходячий замок;2;978-5-35202158-3;null;null;2017;5000;304;33;410;12+;20.7 x 13.4 x 2.8;Твердая глянцевая;448;3;3;7;2;'Книги английской писательницы Дианы У. Джонс настолько ярки, что так и просятся на экран. По ее бестселлеру "Ходячий замок" знаменитый мультипликатор Хаяо Миядзаки ("Унесенные призраками"), обладатель "Золотого льва" - высшей награды Венецианского фестиваля, снял анимационный фильм, побивший в Японии рекорды кассовых сборов. Софи живет в сказочной стране, где ведьмы и русалки, семимильные сапоги и говорящие собаки - обычное дело. Поэтому, когда на нее обрушивается ужасное проклятие коварной Болотной Ведьмы, Софи ничего не остается, как обратиться за помощью к таинственному чародею Хоулу, обитающему в ходячем замке. Однако, чтобы освободиться от чар, Софи предстоит разгадать немало загадок и прожить в замке у Хоула гораздо дольше, чем она рассчитывала. А для этого нужно подружиться с огненным демоном, поймать падучую звезду, подслушать пение русалок, отыскать мандрагору и многое, многое другое.'
12;Анна Каренина;3;978-5-699-93334-1;821.161.1-31;84(2Рос=Рус)1-44;2018;7000;159;25;520;16+;20.5 x 13 x 3;Твердая бумажная;800;1;1;8;1;'"Анна Каренина", один из самых знаменитых романов Льва Толстого, начинается ставшей афоризмом фразой :"Все счастливые семьи похожи друг на друга, каждая несчастливая семья несчастлива по-своему". Это книга о вечных ценностях: о любви, о вере, о семье, о человеческом достоинстве.'
13;Евгений Онегин;1;978-5-699-35677-5;821.161.1-1;83.3(2Рос=Рус)1-5;2017;1000;260;14;490;16+;20.7 x 13.3 x 3.3;Твердая бумажная;640;1;1;3;1;'﻿Александра Сергеевича Пушкина называют создателем русского литературного языка. Когда мы читаем стихи Пушкина, такие гармоничные и простые, кажется, что они именно в такой форме сами легли на бумагу. И нам не видно, сколько труда было им вложено, чтобы получилось так просто и естественно. Пушкин не старался подделываться под какой-либо литературный стиль, он выражал свою мысль такой, какой она возникала у него в уме. В сборник вошли роман в стихах «Евгений Онегин», поэмы, драмы и сказки Пушкина.'
14;Классика пивоварения. Все стили и виды пива от эля до лагера;1;978-5-04-090740-3;null;null;2018;3000;613;2;850;18+;22 x 20.8 x 2.5;Твердая бумажная;304;1;1;9;1;'﻿Основной автор книги, Джамиль Зайнашефф, — многократный победитель конкурсов среди домашних пивоваров, проводящихся в Америке и во всем мире. С его первой золотой медали, полученной на конкурсе Американской Ассоциации Домашних Пивоваров в 2002 году, он неоднократно становился номинантом и победителем подобных конкурсов. Эта книга является сборником всех тех рецептов пива, которые он представлял на соревнованиях. Состоящая из 27 основных глав, книга предлагает рецепты тех основных категорий пива, которые представляют собой номинации в подобных конкурсах, и каждый основной рецепт дополняется несколькими вариантами, так что в целом читателю предлагается 80 рецептов пива домашнего изготовления, охватывающих весь спектр разновидностей пива, известных в наши дни и доступных для домашнего производства.
Соавтор издания — известный эксперт в домашнем пивоварении Джон Палмер, который снабдил книгу материалами по выбору качественных ингредиентов, а также дополнил рецепты Зайнашеффа советами и полезной информацией.'